data.json

{ "item_id": { "0": "i1", "1": "i1", "2": "i1", "3": "i1", "4": "i2", "5": "i2", "6": "i2", "7": "i3", "8": "i3", "9": "i3", "10": "i3", "11": "i4", "12": "i4" }, "tactic": { "0": "new_amount", "1": "new_amount", "2": "x_for_y", "3": "x_for_y", "4": "new_amount", "5": "new_amount", "6": "x_for_y", "7": "x_for_y", "8": "new_amount", "9": "new_amount", "10": "x_for_y", "11": "x_for_y", "12": "new_amount" }, "lowest_category": { "0": "l1", "1": "l1", "2": "l1", "3": "l1", "4": "l1", "5": "l1", "6": "l1", "7": "l2", "8": "l2", "9": "l2", "10": "l2", "11": "l4", "12": "l4" }, "highest_category": { "0": "h1", "1": "h1", "2": "h1", "3": "h1", "4": "h1", "5": "h1", "6": "h1", "7": "h1", "8": "h1", "9": "h1", "10": "h1", "11": "h2", "12": "h2" }, "promo_quantity": { "0": 65.0, "1": 78.0, "2": 82.0, "3": 90.0, "4": 90.0, "5": 70.0, "6": 1.0, "7": 80.0, "8": 50.0, "9": 60.0, "10": 96.0, "11": 45.0, "12": 55.0 }, "sales_quantity": { "0": 100.0, "1": 100.0, "2": 100.0, "3": 100.0, "4": 100.0, "5": 100.0, "6": 100.0, "7": 100.0, "8": 100.0, "9": 100.0, "10": 100.0, "11": 100.0, "12": 100.0 }, "theoretical_discount": { "0": 0.2, "1": 0.25, "2": 0.2, "3": 0.3, "4": 0.3, "5": 0.2, "6": 0.25, "7": 0.3, "8": 0.1, "9": 0.2, "10": 0.25, "11": 0.1, "12": 0.15 }, "effective_discount": { "0": 0.14, "1": 0.19, "2": 0.18, "3": 0.21, "4": 0.29, "5": 0.17, "6": 0.22, "7": 0.26, "8": 0.04, "9": 0.1, "10": 0.24, "11": 0.02, "12": 0.04 } }

my_notes.md

### results after implementing json flattening in beam pipeline.

{'item_id': 'i1', 'tactic': 'new_amount', 'lowest_category': 'l1', 'highest_category': 'h1', 'promo_quantity': 65.0, 'sales_quantity': 100.0, 'theoretical_discount': 0.2, 'effective_discount': 0.14}
{'item_id': 'i1', 'tactic': 'new_amount', 'lowest_category': 'l1', 'highest_category': 'h1', 'promo_quantity': 78.0, 'sales_quantity': 100.0, 'theoretical_discount': 0.25, 'effective_discount': 0.19}
{'item_id': 'i1', 'tactic': 'x_for_y', 'lowest_category': 'l1', 'highest_category': 'h1', 'promo_quantity': 82.0, 'sales_quantity': 100.0, 'theoretical_discount': 0.2, 'effective_discount': 0.18}
{'item_id': 'i1', 'tactic': 'x_for_y', 'lowest_category': 'l1', 'highest_category': 'h1', 'promo_quantity': 90.0, 'sales_quantity': 100.0, 'theoretical_discount': 0.3, 'effective_discount': 0.21}
{'item_id': 'i2', 'tactic': 'new_amount', 'lowest_category': 'l1', 'highest_category': 'h1', 'promo_quantity': 90.0, 'sales_quantity': 100.0, 'theoretical_discount': 0.3, 'effective_discount': 0.29}
{'item_id': 'i2', 'tactic': 'new_amount', 'lowest_category': 'l1', 'highest_category': 'h1', 'promo_quantity': 70.0, 'sales_quantity': 100.0, 'theoretical_discount': 0.2, 'effective_discount': 0.17}
{'item_id': 'i2', 'tactic': 'x_for_y', 'lowest_category': 'l1', 'highest_category': 'h1', 'promo_quantity': 1.0, 'sales_quantity': 100.0, 'theoretical_discount': 0.25, 'effective_discount': 0.22}
{'item_id': 'i3', 'tactic': 'x_for_y', 'lowest_category': 'l2', 'highest_category': 'h1', 'promo_quantity': 80.0, 'sales_quantity': 100.0, 'theoretical_discount': 0.3, 'effective_discount': 0.26}
{'item_id': 'i3', 'tactic': 'new_amount', 'lowest_category': 'l2', 'highest_category': 'h1', 'promo_quantity': 50.0, 'sales_quantity': 100.0, 'theoretical_discount': 0.1, 'effective_discount': 0.04}
{'item_id': 'i3', 'tactic': 'new_amount', 'lowest_category': 'l2', 'highest_category': 'h1', 'promo_quantity': 60.0, 'sales_quantity': 100.0, 'theoretical_discount': 0.2, 'effective_discount': 0.1}
{'item_id': 'i3', 'tactic': 'x_for_y', 'lowest_category': 'l2', 'highest_category': 'h1', 'promo_quantity': 96.0, 'sales_quantity': 100.0, 'theoretical_discount': 0.25, 'effective_discount': 0.24}
{'item_id': 'i4', 'tactic': 'x_for_y', 'lowest_category': 'l4', 'highest_category': 'h2', 'promo_quantity': 45.0, 'sales_quantity': 100.0, 'theoretical_discount': 0.1, 'effective_discount': 0.02}
{'item_id': 'i4', 'tactic': 'new_amount', 'lowest_category': 'l4', 'highest_category': 'h2', 'promo_quantity': 55.0, 'sales_quantity': 100.0, 'theoretical_discount': 0.15, 'effective_discount': 0.04}

### results after normalization

{'item_id': 'i1', 'tactic': 'new_amount', 'lowest_category': 'l1', 'highest_category': 'h1', 'promo_quantity': 65.0, 'sales_quantity': 100.0, 'theoretical_discount': 0.2, 'effective_discount': 0.14}
{'item_id': 'i1', 'tactic': 'new_amount', 'lowest_category': 'l1', 'highest_category': 'h1', 'promo_quantity': 78.0, 'sales_quantity': 100.0, 'theoretical_discount': 0.25, 'effective_discount': 0.19}
{'item_id': 'i1', 'tactic': 'x_for_y', 'lowest_category': 'l1', 'highest_category': 'h1', 'promo_quantity': 82.0, 'sales_quantity': 100.0, 'theoretical_discount': 0.2, 'effective_discount': 0.18}
{'item_id': 'i1', 'tactic': 'x_for_y', 'lowest_category': 'l1', 'highest_category': 'h1', 'promo_quantity': 90.0, 'sales_quantity': 100.0, 'theoretical_discount': 0.3, 'effective_discount': 0.21}
{'item_id': 'i2', 'tactic': 'new_amount', 'lowest_category': 'l1', 'highest_category': 'h1', 'promo_quantity': 90.0, 'sales_quantity': 100.0, 'theoretical_discount': 0.3, 'effective_discount': 0.29}
{'item_id': 'i2', 'tactic': 'new_amount', 'lowest_category': 'l1', 'highest_category': 'h1', 'promo_quantity': 70.0, 'sales_quantity': 100.0, 'theoretical_discount': 0.2, 'effective_discount': 0.17}
{'item_id': 'i2', 'tactic': 'x_for_y', 'lowest_category': 'l1', 'highest_category': 'h1', 'promo_quantity': 1.0, 'sales_quantity': 100.0, 'theoretical_discount': 0.25, 'effective_discount': 0.22}
{'item_id': 'i3', 'tactic': 'x_for_y', 'lowest_category': 'l2', 'highest_category': 'h1', 'promo_quantity': 80.0, 'sales_quantity': 100.0, 'theoretical_discount': 0.3, 'effective_discount': 0.26}
{'item_id': 'i3', 'tactic': 'new_amount', 'lowest_category': 'l2', 'highest_category': 'h1', 'promo_quantity': 50.0, 'sales_quantity': 100.0, 'theoretical_discount': 0.1, 'effective_discount': 0.04}
{'item_id': 'i3', 'tactic': 'new_amount', 'lowest_category': 'l2', 'highest_category': 'h1', 'promo_quantity': 60.0, 'sales_quantity': 100.0, 'theoretical_discount': 0.2, 'effective_discount': 0.1}
{'item_id': 'i3', 'tactic': 'x_for_y', 'lowest_category': 'l2', 'highest_category': 'h1', 'promo_quantity': 96.0, 'sales_quantity': 100.0, 'theoretical_discount': 0.25, 'effective_discount': 0.24}
{'item_id': 'i4', 'tactic': 'x_for_y', 'lowest_category': 'l4', 'highest_category': 'h2', 'promo_quantity': 45.0, 'sales_quantity': 100.0, 'theoretical_discount': 0.1, 'effective_discount': 0.02}
{'item_id': 'i4', 'tactic': 'new_amount', 'lowest_category': 'l4', 'highest_category': 'h2', 'promo_quantity': 55.0, 'sales_quantity': 100.0, 'theoretical_discount': 0.15, 'effective_discount': 0.04}

### results after keying transformation

('i1', {'item_id': 'i1', 'tactic': 'new_amount', 'lowest_category': 'l1', 'highest_category': 'h1', 'promo_quantity': 65.0, 'sales_quantity': 100.0, 'theoretical_discount': 0.2, 'effective_discount': 0.14})
('i1', {'item_id': 'i1', 'tactic': 'new_amount', 'lowest_category': 'l1', 'highest_category': 'h1', 'promo_quantity': 78.0, 'sales_quantity': 100.0, 'theoretical_discount': 0.25, 'effective_discount': 0.19})
('i1', {'item_id': 'i1', 'tactic': 'x_for_y', 'lowest_category': 'l1', 'highest_category': 'h1', 'promo_quantity': 82.0, 'sales_quantity': 100.0, 'theoretical_discount': 0.2, 'effective_discount': 0.18})
('i1', {'item_id': 'i1', 'tactic': 'x_for_y', 'lowest_category': 'l1', 'highest_category': 'h1', 'promo_quantity': 90.0, 'sales_quantity': 100.0, 'theoretical_discount': 0.3, 'effective_discount': 0.21})
('i2', {'item_id': 'i2', 'tactic': 'new_amount', 'lowest_category': 'l1', 'highest_category': 'h1', 'promo_quantity': 90.0, 'sales_quantity': 100.0, 'theoretical_discount': 0.3, 'effective_discount': 0.29})
('i2', {'item_id': 'i2', 'tactic': 'new_amount', 'lowest_category': 'l1', 'highest_category': 'h1', 'promo_quantity': 70.0, 'sales_quantity': 100.0, 'theoretical_discount': 0.2, 'effective_discount': 0.17})
('i2', {'item_id': 'i2', 'tactic': 'x_for_y', 'lowest_category': 'l1', 'highest_category': 'h1', 'promo_quantity': 1.0, 'sales_quantity': 100.0, 'theoretical_discount': 0.25, 'effective_discount': 0.22})
('i3', {'item_id': 'i3', 'tactic': 'x_for_y', 'lowest_category': 'l2', 'highest_category': 'h1', 'promo_quantity': 80.0, 'sales_quantity': 100.0, 'theoretical_discount': 0.3, 'effective_discount': 0.26})
('i3', {'item_id': 'i3', 'tactic': 'new_amount', 'lowest_category': 'l2', 'highest_category': 'h1', 'promo_quantity': 50.0, 'sales_quantity': 100.0, 'theoretical_discount': 0.1, 'effective_discount': 0.04})
('i3', {'item_id': 'i3', 'tactic': 'new_amount', 'lowest_category': 'l2', 'highest_category': 'h1', 'promo_quantity': 60.0, 'sales_quantity': 100.0, 'theoretical_discount': 0.2, 'effective_discount': 0.1})
('i3', {'item_id': 'i3', 'tactic': 'x_for_y', 'lowest_category': 'l2', 'highest_category': 'h1', 'promo_quantity': 96.0, 'sales_quantity': 100.0, 'theoretical_discount': 0.25, 'effective_discount': 0.24})
('i4', {'item_id': 'i4', 'tactic': 'x_for_y', 'lowest_category': 'l4', 'highest_category': 'h2', 'promo_quantity': 45.0, 'sales_quantity': 100.0, 'theoretical_discount': 0.1, 'effective_discount': 0.02})
('i4', {'item_id': 'i4', 'tactic': 'new_amount', 'lowest_category': 'l4', 'highest_category': 'h2', 'promo_quantity': 55.0, 'sales_quantity': 100.0, 'theoretical_discount': 0.15, 'effective_discount': 0.04})